{
  "id": "align_00000000-0000-0000-0000-000000000001",
  "signal_ids": [
    "sig_00000000-0000-0000-0000-000000000001",
    "sig_00000000-0000-0000-0000-000000000002"
  ],
  "reference_signal_id": "sig_00000000-0000-0000-0000-000000000001",
  "warp_path": [[0, 0], [1, 1], [2, 3], [3, 4], [4, 5]],
  "confidence": 0.92,
  "hop_length_ms": 46.44,
  "method": "dtw_chroma",
  "streaming": false
}
